{
  "id": "anthropic-claude-haiku",
  "cursorModelId": {
    "value": "example-cursor-model-id",
    "provenance": { "source": "provider_docs", "sourceUrl": "https://cursor.com/docs/models-and-pricing", "retrievedAt": "2026-01-01T00:00:00.000Z", "lastVerified": "2026-01-01T00:00:00.000Z", "confidence": 0.3, "license": null }
  },
  "cursorAvailability": "documented",
  "provider": "anthropic",
  "displayName": "Claude Haiku (seed)",
  "status": "active",
  "statusChangedAt": "2026-01-01T00:00:00.000Z",
  "version": "3.5",
  "releaseDate": "2024-03-01T00:00:00.000Z",
  "deprecatedAt": null,
  "availability": { "regions": ["global"], "requiresMaxMode": false, "tier": "free" },
  "pricing": {
    "inputPerMillion": { "value": 0.25, "provenance": { "source": "provider_docs", "sourceUrl": null, "retrievedAt": "2026-01-01T00:00:00.000Z", "lastVerified": "2026-01-01T00:00:00.000Z", "confidence": 0.3, "license": null } },
    "outputPerMillion": { "value": 1.25, "provenance": { "source": "provider_docs", "sourceUrl": null, "retrievedAt": "2026-01-01T00:00:00.000Z", "lastVerified": "2026-01-01T00:00:00.000Z", "confidence": 0.3, "license": null } },
    "currency": "USD",
    "unknown": false
  },
  "context": {
    "maxInputTokens": { "value": 200000, "provenance": { "source": "provider_docs", "sourceUrl": null, "retrievedAt": "2026-01-01T00:00:00.000Z", "lastVerified": "2026-01-01T00:00:00.000Z", "confidence": 0.3, "license": null } },
    "maxOutputTokens": { "value": 8192, "provenance": { "source": "provider_docs", "sourceUrl": null, "retrievedAt": "2026-01-01T00:00:00.000Z", "lastVerified": "2026-01-01T00:00:00.000Z", "confidence": 0.3, "license": null } }
  },
  "features": {
    "vision": { "value": true, "provenance": { "source": "manual_curated", "sourceUrl": null, "retrievedAt": "2026-01-01T00:00:00.000Z", "lastVerified": "2026-01-01T00:00:00.000Z", "confidence": 0.3, "license": null } },
    "functionCalling": { "value": true, "provenance": { "source": "manual_curated", "sourceUrl": null, "retrievedAt": "2026-01-01T00:00:00.000Z", "lastVerified": "2026-01-01T00:00:00.000Z", "confidence": 0.3, "license": null } },
    "toolUse": { "value": true, "provenance": { "source": "manual_curated", "sourceUrl": null, "retrievedAt": "2026-01-01T00:00:00.000Z", "lastVerified": "2026-01-01T00:00:00.000Z", "confidence": 0.3, "license": null } },
    "structuredOutput": { "value": true, "provenance": { "source": "manual_curated", "sourceUrl": null, "retrievedAt": "2026-01-01T00:00:00.000Z", "lastVerified": "2026-01-01T00:00:00.000Z", "confidence": 0.3, "license": null } },
    "streaming": { "value": true, "provenance": { "source": "manual_curated", "sourceUrl": null, "retrievedAt": "2026-01-01T00:00:00.000Z", "lastVerified": "2026-01-01T00:00:00.000Z", "confidence": 0.3, "license": null } },
    "reasoningMode": { "value": false, "provenance": { "source": "manual_curated", "sourceUrl": null, "retrievedAt": "2026-01-01T00:00:00.000Z", "lastVerified": "2026-01-01T00:00:00.000Z", "confidence": 0.3, "license": null } }
  },
  "capabilities": {
    "coding": { "value": 6.8, "provenance": { "source": "manual_curated", "sourceUrl": null, "retrievedAt": "2026-01-01T00:00:00.000Z", "lastVerified": "2026-01-01T00:00:00.000Z", "confidence": 0.35, "license": null } },
    "reasoning": { "value": 6.0, "provenance": { "source": "manual_curated", "sourceUrl": null, "retrievedAt": "2026-01-01T00:00:00.000Z", "lastVerified": "2026-01-01T00:00:00.000Z", "confidence": 0.35, "license": null } },
    "planning": { "value": 5.5, "provenance": { "source": "manual_curated", "sourceUrl": null, "retrievedAt": "2026-01-01T00:00:00.000Z", "lastVerified": "2026-01-01T00:00:00.000Z", "confidence": 0.35, "license": null } },
    "longContext": { "value": 7.5, "provenance": { "source": "manual_curated", "sourceUrl": null, "retrievedAt": "2026-01-01T00:00:00.000Z", "lastVerified": "2026-01-01T00:00:00.000Z", "confidence": 0.35, "license": null } }
  },
  "latency": {
    "p50Ms": { "value": 1500, "provenance": { "source": "manual_curated", "sourceUrl": null, "retrievedAt": "2026-01-01T00:00:00.000Z", "lastVerified": "2026-01-01T00:00:00.000Z", "confidence": 0.3, "license": null } }
  },
  "aliases": ["claude-haiku", "anthropic/claude-haiku"],
  "validationStatus": "ok",
  "limitations": ["Less capable for complex reasoning"],
  "strengths": ["Fast", "Low cost", "Long context"]
}
