{
  "id": "mistral-large",
  "cursorAvailability": "unverified",
  "provider": "mistral",
  "displayName": "Mistral Large (seed)",
  "status": "active",
  "statusChangedAt": "2026-01-01T00:00:00.000Z",
  "version": "2",
  "releaseDate": "2024-11-01T00:00:00.000Z",
  "deprecatedAt": null,
  "availability": { "regions": ["global"], "requiresMaxMode": false, "tier": "standard" },
  "pricing": {
    "inputPerMillion": { "value": 2.0, "provenance": { "source": "provider_docs", "sourceUrl": null, "retrievedAt": "2026-01-01T00:00:00.000Z", "lastVerified": "2026-01-01T00:00:00.000Z", "confidence": 0.3, "license": null } },
    "outputPerMillion": { "value": 6.0, "provenance": { "source": "provider_docs", "sourceUrl": null, "retrievedAt": "2026-01-01T00:00:00.000Z", "lastVerified": "2026-01-01T00:00:00.000Z", "confidence": 0.3, "license": null } },
    "currency": "USD",
    "unknown": false
  },
  "context": {
    "maxInputTokens": { "value": 128000, "provenance": { "source": "provider_docs", "sourceUrl": null, "retrievedAt": "2026-01-01T00:00:00.000Z", "lastVerified": "2026-01-01T00:00:00.000Z", "confidence": 0.3, "license": null } },
    "maxOutputTokens": { "value": 8192, "provenance": { "source": "provider_docs", "sourceUrl": null, "retrievedAt": "2026-01-01T00:00:00.000Z", "lastVerified": "2026-01-01T00:00:00.000Z", "confidence": 0.3, "license": null } }
  },
  "features": {
    "vision": { "value": false, "provenance": { "source": "manual_curated", "sourceUrl": null, "retrievedAt": "2026-01-01T00:00:00.000Z", "lastVerified": "2026-01-01T00:00:00.000Z", "confidence": 0.3, "license": null } },
    "functionCalling": { "value": true, "provenance": { "source": "manual_curated", "sourceUrl": null, "retrievedAt": "2026-01-01T00:00:00.000Z", "lastVerified": "2026-01-01T00:00:00.000Z", "confidence": 0.3, "license": null } },
    "toolUse": { "value": true, "provenance": { "source": "manual_curated", "sourceUrl": null, "retrievedAt": "2026-01-01T00:00:00.000Z", "lastVerified": "2026-01-01T00:00:00.000Z", "confidence": 0.3, "license": null } },
    "structuredOutput": { "value": true, "provenance": { "source": "manual_curated", "sourceUrl": null, "retrievedAt": "2026-01-01T00:00:00.000Z", "lastVerified": "2026-01-01T00:00:00.000Z", "confidence": 0.3, "license": null } },
    "streaming": { "value": true, "provenance": { "source": "manual_curated", "sourceUrl": null, "retrievedAt": "2026-01-01T00:00:00.000Z", "lastVerified": "2026-01-01T00:00:00.000Z", "confidence": 0.3, "license": null } },
    "reasoningMode": { "value": false, "provenance": { "source": "manual_curated", "sourceUrl": null, "retrievedAt": "2026-01-01T00:00:00.000Z", "lastVerified": "2026-01-01T00:00:00.000Z", "confidence": 0.3, "license": null } }
  },
  "capabilities": {
    "coding": { "value": 7.2, "provenance": { "source": "manual_curated", "sourceUrl": null, "retrievedAt": "2026-01-01T00:00:00.000Z", "lastVerified": "2026-01-01T00:00:00.000Z", "confidence": 0.35, "license": null } },
    "reasoning": { "value": 7.5, "provenance": { "source": "manual_curated", "sourceUrl": null, "retrievedAt": "2026-01-01T00:00:00.000Z", "lastVerified": "2026-01-01T00:00:00.000Z", "confidence": 0.35, "license": null } },
    "planning": { "value": 6.5, "provenance": { "source": "manual_curated", "sourceUrl": null, "retrievedAt": "2026-01-01T00:00:00.000Z", "lastVerified": "2026-01-01T00:00:00.000Z", "confidence": 0.35, "license": null } },
    "longContext": { "value": 6.0, "provenance": { "source": "manual_curated", "sourceUrl": null, "retrievedAt": "2026-01-01T00:00:00.000Z", "lastVerified": "2026-01-01T00:00:00.000Z", "confidence": 0.35, "license": null } }
  },
  "latency": {
    "p50Ms": { "value": 4500, "provenance": { "source": "manual_curated", "sourceUrl": null, "retrievedAt": "2026-01-01T00:00:00.000Z", "lastVerified": "2026-01-01T00:00:00.000Z", "confidence": 0.3, "license": null } }
  },
  "aliases": ["mistral-large"],
  "validationStatus": "ok",
  "limitations": [],
  "strengths": ["European provider", "Multilingual"]
}
